article_text,paragraphs,article,n_characters,news_site,article_text_eng,Sentiment,Mixed,Negative,Neutral,Positive
"Éppen erre a pontra építik egyébként az ellenzéki önkormányzatok azt a népszavazási kampányukat, amit a ""Szabad Városok"" nevében hirdettek meg Karácsony Gergely budapesti főpolgármester vezetésével. A csatlakozó településeken helyi népszavazásokon mondatnák ki a lakossággal, hogy szeretnék, ha az önkormányzatok közvetlenül kaphatnának EU-s támogatásokat a költségvetéshez csatolt gazdasági mentőcsomagból. Ezt általában is akarják ezek a városok, de ha a magyar kormányt szankció alá vonnák, akkor egy ilyen népszavazásos felhatalmazással még könnyebben intézhetnék el, hogy átvehessék a pénzosztás feladatát. ",17,21,612,444,"It is on this point that the opposition municipalities build their referendum campaign, which they announced on behalf of the “Free Cities” under the leadership of Gergely Karácsony, chief mayor of Budapest. In the acceding towns, local referendums would make the public say that they would like the municipalities to be able to receive EU subsidies directly from the economic rescue package attached to the budget. This is what these cities usually want, but if the Hungarian government were sanctioned, it would be even easier with such a referendum mandate to take over the task of distributing money.",NEUTRAL,0.006368182133883238,0.07997731119394302,0.8986368775367737,0.015017635188996792
"A júliusi nehéz alku után, ebben a járvánnyal és Brexittel terhelt időszakban, az európai politikusok többsége a háta közepére se kíván egy újabb vitát a költségvetésről és a mentőcsomagról. Ráadásul a mentőcsomag nagyon kell Olaszországnak és Spanyolországnak, a benne lévő pénz jelentős részét nekik szánták a többiek, és áttételesen kell a mentőcsomag az eurózóna összes többi tagjának is, hogy a közös pénz stabilitását ne veszélyeztesse a déliek csődközeli helyzete. Nem véletlen, hogy a mentőcsomag egy német - francia közös javaslat alapján született, általában az európai gazdaság megmentése érdekében. ",18,21,611,444,"After the difficult bargain in July, in this period of epidemic and Brexit, the majority of European politicians do not want another debate on the budget and the rescue package to the middle of their backs. In addition, the rescue package is very much needed for Italy and Spain, a significant part of the money in it was intended for them, and the rescue package must be leveraged to all other members of the eurozone, so that the stability of the common money is not jeopardised by the situation of the Southerners near bankruptcy. It is no coincidence that the rescue package was made on the basis of a joint proposal from Germany to France, in general, in order to save the European economy.",MIXED,0.7484011650085449,0.06325133889913559,0.1666407734155655,0.02170676179230213
"A nettó befizetőnek számító országokban pedig belpolitikai ügy lett a mechanizmus kikényszerítéséből, a holland miniszterelnököt például hosszú vitában vonták kérdőre a hágai parlamentben, hogy miért nem keményebbek a feltételek a renitens tagállamokkal szemben, miért kell ennyit költeni antidemokratikus rezsimek finanszírozására. ",19,21,333,444,"In the net contributor countries, enforcing the mechanism has become a domestic matter. For example, the Dutch prime minister has been questioned in the Hague Parliament in a long debate on why the conditions are not tougher compared to the renitent Member States, why it is necessary to spend so much to finance undemocratic regimes.",NEUTRAL,7.809954695403576e-5,0.050927065312862396,0.9461211562156677,0.002873785328119993
"A magyar és a lengyel vétó ezért az eddigieknél is jobban szembe állíthatja e két országot a többiekkel, bár ennek lehetséges politikai következményeit most még nehéz megjósolni. A két ellenálló ország elszántságát talán az amerikai elnökválasztás eredménye is növelte, mert tartanak a demokrata adminisztráció keménykedésétől, és nem akarnak az európai kritikusok kezébe adni egy új eszközt olyan időszakban, amikor egyébként is nagyobb lesz rajtuk a nyomás Nyugat felől.  ",20,21,474,444,"The Hungarian and Polish vetos can therefore face these two countries more than ever, although the possible political consequences of this are still difficult to predict. Perhaps the determination of the two resistance countries has also been increased by the outcome of the US presidential election, because they fear the hardness of the Democratic administration, and they do not want to give the European critics a new instrument at a time when they are already under pressure from the West.",MIXED,0.8715081810951233,0.02120448648929596,0.10467012971639633,0.0026171787176281214
"Az eddigi nyilatkozatok alapján egyik vétóra készülő kormányt sem ijeszti meg az ütközés a többiekkel, sőt, kifejezetten gerjesztik a feszültséget. A lengyel külügyminiszter-helyettes 11-én, a lengyel nemzeti ünnepen azt mondta, hogy a jogállamisági mechanizmus a német gyarmatosítás eszköze lenne, míg a magyar igazságügyi miniszter politikai zsarolással vádolta a mechanizmus támogatóit. ",21,21,390,444,"According to the statements so far, none of the governments that are preparing to veto are frightened by the collision with the others, and even they are expressly arming tension. On 11, the Polish Deputy Minister of Foreign Affairs said that the rule of law mechanism would be a means of German colonization, while the Hungarian Minister of Justice accused the supporters of political blackmail.",NEUTRAL,0.001279087271541357,0.25801554322242737,0.7386988997459412,0.002006464172154665
"Az egyelőre nem világos, hogy a vétót a magyarok és a lengyelek hogyan képzelik. Nagyon nem mindegy, hogy általában vétóznák-e meg a költségvetést, vagy csak a mentőcsomagot fúrják ki onnan. ",22,21,191,444,It is not yet clear how the veto is imagined by Hungarians and Poles. It doesn't matter whether the budget is usually vetoed or the rescue package is drilled out.,NEUTRAL,0.02977782115340233,0.3809574246406555,0.5843220353126526,0.004942671861499548
"Orbán Viktor levele szerint ""növekszik a valószínűsége"", hogy a magyar kormány ""nem lesz abban a pozícióban"", hogy hozzájárulását adja a szükséges konszenzushoz, ami a csomag elfogadásához kell. Ez inkább egy általános, a teljes költségvetést akadályozó vétóra utal.",23,21,266,444,"According to Viktor Orbán's letter, “the probability is increasing” that the Hungarian Government will “not be in the position” to give its consent to the necessary consensus for the adoption of the package. Rather, this refers to a general veto that hinders the entire budget.",NEUTRAL,8.812017040327191e-5,0.1294558048248291,0.8688598275184631,0.0015961813041940331
"Morawiecki a saját levelében viszont csak azt helyezte kilátásba, hogy a lengyel parlamenten nem megy majd át a csomag. Márpedig ott csak a mentőcsomag létrejöttéhez szükséges felhatalmazásáról szavaznak majd, azaz arról, hogy az Európai Bizottság felvehet-e hitelt a 750 milliárdos rész megszerzéséhez. (A másik ezermilliárdos költségvetési tétel a tagállamok éves befizetéseiből jön össze.) Mivel a mostani állás szerint a költségvetés két része jogilag összefügg, a lengyel parlamenti vétó is fenyegetheti az egész megállapodást, viszont Varsó pozíciójából következhet egy olyan megoldás is, hogy az EU szétválassza jogilag a két részt. Ezért a lengyel pozíciót rugalmasabbnak tartják Brüsszelben, mint a magyart. ",24,21,717,444,"Morawiecki, in his own letter, only foresaw that the package would not pass through the Polish Parliament. There they will only vote on its mandate to create a rescue package, i.e. whether the European Commission can borrow a loan to acquire the EUR 750 billion share. (The other thousand billion budget line comes together with the annual contributions of the Member States.) Since the two parts of the budget are legally linked, the Polish parliamentary veto could threaten the whole agreement, but Warsaw's position could also lead to a solution for the EU to legally divide the two parts. Therefore, the Polish position is considered to be more flexible in Brussels than the Hungarian one.",NEUTRAL,0.002490587066859007,0.04853237420320511,0.9350284934043884,0.013948541134595871
"Először a Spiegel írt arról, hogy ha ez a parlamenti típusú következne, akkor  kivehetnék a mentőcsomagot a költségvetési törvényből a mentőcsomagot, és egy kormányközi megállapodással is összerakhatnák - ahogy ez történt a görög mentőcsomag esetén, az ESM nevű alapkezelő létrehozásával 2015-ben. Ebben az esetben Magyarország és Lengyelország kimaradnának az alapból, onnan pénzt nem hívhatnának le, de a 2028 utáni törlesztésbe se kellene beszállniuk. A magyar kormány eleve úgy gondolta, hogy a csomagból túl kevés jutna ide, és Orbán Viktor a nyáron célozgatott arra is, hogy a mentőcsomag a magyaroknak nem kell, mert a vírust mi tudtuk kezelni, és csak azért járult hozzá a megteremtéséhez, mert ennyire szolidáris a rászoruló országokkal. Azóta persze jött a második hullám, ami felülírhatta a kormányfő hozzáállását a csomaghoz.",25,21,837,444,"Firstly, Spiegel wrote that if this parliamentary type were to follow, they could remove the rescue package from the Budget Act and put it together with an intergovernmental agreement - as was the case with the Greek rescue package, with the establishment of a fund manager called ESM in 2015. In this case, Hungary and Poland would be omitted from the fund, they would not be able to withdraw money from there, but they would not have to join the repayment after 2028. The Hungarian Government thought that too little of the package would get here, and this summer Mr. Orbán also insinuated that the Hungarians do not need the rescue package because we were able to treat the virus and only contributed to its creation because he is so solidarity with the countries in need. Since then, of course, the second wave came, which could override the Prime Minister's attitude to the package.",NEUTRAL,0.036506082862615585,0.07963017374277115,0.862930417060852,0.02093329280614853
"Ha a teljes vétóval fenyegetne a magyar és a lengyel kormány, akkor viszont nagyon nehéz lesz megoldást találni:",26,21,112,444,"If the Hungarian and Polish governments threaten with a full veto, it will be very difficult to find a solution:",NEGATIVE,0.014038505963981152,0.5848382115364075,0.3932701647281647,0.007853037677705288
"Egyelőre nem látszik a köztes megoldás, mert a magyar módosítási javaslatok alapjaiban írnák át a mostani szöveget, tehát első ránézésre nem néhány jól meghatározható részleten megy a vita, hanem az egész jogszabály szellemiségén és alkalmazhatóságán. ",27,21,253,444,"The intermediate solution is not yet apparent, because the Hungarian amendments proposals would fundamentally rewrite the current text, so at first glance the debate is not on a few clearly defined details, but on the spirit and applicability of the whole legislation.",NEUTRAL,0.026963217183947563,0.3330521881580353,0.6293735504150391,0.01061108149588108
"A kérdés az, hogy ebben mennyi a blöff, és van-e néhány olyan sarkalatos pont - például a fellebbezés lehetősége az EU bíróságához - aminek kielégítésével Budapest és Varsó elállhat a vétótól.",28,21,193,444,"The question is, how much is the bluff in this, and whether there are some important points - such as the possibility of appealing to the EU court - with which Budapest and Warsaw can resist the veto.",NEUTRAL,3.268372092861682e-4,0.1895151287317276,0.8038370609283447,0.006320970598608255
"Ahogyan korábban beszámoltunk róla, a Mandiner információi szerint Orbán Viktor miniszterelnök kész megvétózni az európai uniós költségvetést és a helyreállítási alapot is, amennyiben jogállamisághoz kötik az egyes tagállamoknak szánt források kifizetését. A miniszterelnök erről levelet is írt az Európai Unió német soros elnökségének.",1,1,336,24,"As we reported earlier, according to Mandiner's information, Prime Minister Viktor Orbán is prepared to veto both the EU budget and the recovery fund, if the payment of funds allocated to individual Member States is tied to the rule of law. The Prime Minister also wrote a letter to the German presidency of the European Union.",NEUTRAL,1.2428450281731784e-4,0.04338120296597481,0.9509633183479309,0.005531230475753546
"A Népszava friss cikke szerint még ma eldőlhet, hogy ez a vétófenyegetés mennyire komoly. A miniszteri szintű EU Tanácsot elnöklő Németország azt szeretné, ha már a nagykövetek hétfői ülésén elvi egyetértés születne a csomagról. Tehát már ma kiderülhet, hogy Orbán Viktor és lengyel kollégája, Mateusz Morawiecki komolyan gondolta-e a vétóval való fenyegetést.",2,1,360,24,"According to the recent article of Népszava, it may be decided today how serious this threat of veto is. Germany, presiding over the EU Council at ministerial level, would like a principled agreement on the package at the meeting of the ambassadors on Monday. So today we can find out whether Viktor Orbán and his Polish colleague Mateusz Morawiecki were serious about the threat of veto.",NEUTRAL,8.174456161214039e-5,0.17514175176620483,0.8214014768600464,0.0033749653957784176
"Az Unió jövő évi költségvetéséről szóló EP-határozat a képviselő-testület álláspontját rögzíti arról, hogy jövőre a közösségnek mire és mennyit kellene költenie. A jóváhagyást követően a parlamentnek és a kormányokat képviselő EU Tanácsnak együtt kell kidolgoznia a mindkét társjogalkotó számára elfogadható politikai megállapodást, legkésőbb december elejéig — teszi hozzá a lap.",3,1,380,24,"The EP Decision on the EU budget for next year sets out the position of the representative body on what and how much the community should spend next year. After approval, the parliament and the EU Council representing governments should jointly draw up a political agreement acceptable to both co-legislators by early December at the latest, adds.",NEUTRAL,2.200521994382143e-4,4.125965351704508e-4,0.9898045063018799,0.00956281740218401
"A Népszava felidézi Ujhelyi István szocialista EP-képviselő Facebook-posztját, amely szerint a néppárti frakcióból egyedül a Fidesz európai parlamenti képviselői nem szavazták meg az EU 2021. évi költségvetéséről szóló parlamenti határozatot. Ujhelyi szerint a magyar kormánypárti képviselők a múlt csütörtökön nagy többséggel jóváhagyott állásfoglalásra leadott ellenszavazatukkal „Orbán veszélyes játékát támogatták a hétéves költségvetés vétójával kapcsolatban.”",4,1,465,24,"Népszava recalls the Facebook post of Socialist MEP István Ujhelyi, according to which Fidesz MEP members of the EPP alone did not vote in favour of the parliamentary resolution on the EU's 2021 budget. According to Ujhelyi, the Hungarian pro-government MEPs voted against for a resolution approved last Thursday by a large majority, “Orbán's dangerous game in connection with the veto of the seven-year budget.”",NEUTRAL,2.346584078622982e-4,0.03733859956264496,0.9612717628479004,0.0011549630435183644
Kiemelt kép: MTI/Miniszterelnöki Sajtóiroda/Fischer Zoltán,5,1,58,24,Featured image: MTI/Prime Minister's Press Office/Zoltán Fischer,NEUTRAL,1.1213039215363096e-5,6.7392538767308e-5,0.9994626641273499,4.5875331852585077e-4
"A Portfolio információi szerint hétfő délután politikai vétót emel a magyar kormány Brüsszelben a 2021-2027-es uniós költségvetés és a helyreállítási alappal kapcsolatos saját forrás rendelet ügyében. Hozzáteszik, hogy ez még nem a hivatalos formális (jogi) vétót jelenti, de az is jöhet napokon belül.",1,2,302,24,"According to Portfolio, on Monday afternoon the Hungarian government raises a political veto in Brussels on the issue of the EU budget 2021-2027 and the own resources regulation related to the recovery fund. They add that this does not mean the formal (legal) veto, but it can also come within days.",NEUTRAL,0.00493236118927598,0.008830232545733452,0.9480909109115601,0.0381464958190918
"A jogállamisági rendeletben – amely jogállami kritériumokhoz kötné az uniós források kifizetését – nem követelmény az egyhangúság, így ott nem vétóról van szó, hanem egy elutasító magyar (és lengyel) álláspontról, de ettől még ez a rendelet hatályba tud majd lépni.",2,2,265,24,"In the Rule of Law Regulation, which would link the payment of EU funds to the rule of law criteria, unanimity is not a requirement, so it is not a veto, but a negative Hungarian (and Polish) position, but this regulation will still be able to enter into force.",NEUTRAL,3.536435542628169e-4,0.034758057445287704,0.9546669721603394,0.010221399366855621
"A német soros elnökség hétfő délutáni brüsszeli tanácskozásán minden tagállamnak politikai állásfoglalást kell tennie a három szóban forgó rendeletről, ez lényegében egy tesztszavazásnak fog számítani.",3,2,201,24,"At the German presidency meeting in Brussels on Monday afternoon, all Member States must take a political position on the three regulations in question, which will essentially constitute a test vote.",NEUTRAL,1.2094085104763508e-4,0.010598457418382168,0.9820623993873596,0.007218272425234318
"A Portfolio szerint a három rendelet útjai szét fognak válni: a jogállamisági rendelet már jövő év januárjában hatályba léphet, a megvétózható két másik rendeletről szerdán dönthetnek, és még az Európai Parlamentnek is jóvá kell hagyni a döntést.",4,2,246,24,"According to Portfolio, the three regulations will separate: the rule of law regulation can enter into force in January next year, the two other regulations that can be vetoed can be decided on Wednesday, and even the European Parliament will have to approve the decision.",NEUTRAL,1.049633210641332e-4,0.004726587329059839,0.989072859287262,0.00609565107151866
"Varga Judit igazságügyminiszter hétfő délelőtti Facebook-posztjából is arra lehet következtetni, hogy vétóra készül a kormány:",5,2,126,24,"Judit Varga, Minister of Justice Judit Varga can also be inferred from Monday morning's Facebook post that the government is preparing a veto:",NEUTRAL,1.8877948605222628e-5,0.021219059824943542,0.9775524139404297,0.001209595357067883
"Aki ismeri a magyar történelmet, az pontosan tudja, hogy amikor gyermekeink és unokáink jövőjéről van szó, akkor a magyar emberek és Magyarország nem köt kompromisszumot, jelentsen ez akár szabadságharcot, akár csak egy egyszerű vétót",6,2,234,24,"Those who are familiar with Hungarian history know that when it comes to the future of our children and grandchildren, the Hungarian people and Hungary do not commit compromises, whether it is a fight for freedom or a simple veto",NEUTRAL,4.341418680269271e-4,0.03092513233423233,0.9567956328392029,0.011845095083117485
– írta a miniszter.,7,2,19,24,— the minister wrote.,NEUTRAL,5.050824256613851e-4,0.002553472062572837,0.9961620569229126,7.793593686074018e-4
"Ha Magyarország és Lengyelország vétózik, akkor az egész uniós költségvetési döntéshozatal megakad. A Portfolio szerint „hatalmas nyomásgyakorlás indulhat a két tagállam felé, hogy engedjenek, ne tartsák fel a többi 25 tagállamot az uniós költségvetési döntések útján akkor, amikor a koronavírus-járvány egyébként is tombol és szükség lenne mielőbb a válságkezelést enyhítő pénzekre. A nyomásgyakorlással párhuzamosan a háttérben elindulhat egy egyezkedés, hogy hogyan lehetne módosítani úgy a jogállamisági feltételrendszert, hogy az már elfogadható legyen a két tagállamnak”.",8,2,577,24,"If Hungary and Poland veto, the whole EU budget decision-making will be stuck. According to Portfolio, “there may be a huge pressure on the two Member States to allow, not to detain the other 25 Member States from EU budget decisions when the coronavirus epidemic is already raging, and money to mitigate crisis management is needed as soon as possible. Simultaneously with pressure, a discussion can be started on how to change the rule of law conditionality so that it is acceptable to the two Member States”.",NEUTRAL,0.0012700101360678673,0.25311437249183655,0.7404115200042725,0.005204032640904188
"Ha nem sikerül megegyezni, akkor a helyreállítási alapról kormányközi alapon egyezhetnek meg: így Magyarországot kihagyhatják, azaz Orbán Viktor 16 milliárd eurónyi forrásról mondhat le a jogállamisági kritériumok miatt.",9,2,220,24,"If an agreement is not reached, the recovery fund can be agreed on an intergovernmental basis: this way Hungary can be omitted, i.e. Viktor Orbán can renounce EUR 16 billion in resources due to the rule of law criteria.",NEUTRAL,0.015976950526237488,0.10206649452447891,0.8301683664321899,0.05178820714354515
"Kiemelt kép: A Miniszterelnöki Sajtóiroda által közreadott képen Orbán Viktor miniszterelnök (j) a résztvevő miniszterelnökökkel egyeztet a rendkívüli uniós csúcstalálkozón Brüsszelben 2020. február 21-én. Balról jobbra António Costa portugál kormányfő, Nikosz Anasztasziadisz ciprusi elnök, Robert Abela máltai, Peter Pellegrini szlovák és Juri Ratas észt miniszterelnök. Fotó: MTI/Miniszterelnöki Sajtóiroda/Benko Vivien Cher",10,2,427,24,"Featured image: In a photo published by the Prime Minister's Press Office, Prime Minister Viktor Orbán (j) will consult the participating prime ministers at the extraordinary EU summit in Brussels on 21 February 2020. From left to right, Portuguese Prime Minister António Costa, Cypriot President Nikos Anastasiadis, Robert Abela of Malta, Slovak Peter Pellegrini and Estonian Prime Minister Yuri Ratas. Photo: MTI/Prime Minister's Press Office/Benko Vivien Cher",NEUTRAL,3.5659286368172616e-6,1.2553487613331527e-4,0.9985499978065491,0.00132088887039572
"Korábban a Portfolio értesülései alapján beszámoltunk róla, hogy hétfő délután politikai vétót emel a magyar kormány Brüsszelben a 2021-2027-es uniós költségvetés és a helyreállítási alappal kapcsolatos saját forrás rendelet ügyében. A lap szerint ez még nem a hivatalos formális (jogi) vétót jelenti, de az is jöhet napokon belül.",1,3,331,24,"Earlier, on the basis of Portfolio, we reported that on Monday afternoon the Hungarian government will raise a political veto in Brussels on the EU budget 2021-2027 and the own resources regulation related to the recovery fund. According to the newspaper, this does not mean the formal (legal) veto, but it can also come within days.",NEUTRAL,7.038202602416277e-4,0.01752946339547634,0.9518721103668213,0.029894601553678513
"Kovács Zoltán kormányszóvivő a Reuters hírügynökségnek arról beszélt:  Magyarország egyértelmű parlamenti felhatalmazással vesz részt az ülésen. Júliusban az Országgyűlés fideszes többsége határozatban szólította fel a kormányt,  hogy ne fogadja el az EU hétéves költségvetését és a koronavírus utáni helyreállítási alapot, amíg nem zárják le a jogállamiságról szóló, 7. cikkely szerinti eljárást. Arra a kérdésre, hogy ez azt jelenti-e, hogy Magyarország megvétózza az 1,1 milliárd eurós  költségvetést és a 750 milliárd eurós saját forrásokról szóló határozatot, amennyiben nem vizsgálják felül a a jogállamisági kritériumokat, Kovács azt felelte:",2,3,649,24,"Government spokesperson Zoltán Kovács told the Reuters news agency that Hungary will participate in the meeting with a clear parliamentary mandate. In July, the Fidesz majority of the Parliament called on the government by decision not to accept the EU's seven-year budget and the post-coronavirus recovery fund until the procedure under Article 7 on the rule of law was completed. On the question whether this means that Hungary will veto the budget of EUR 1.1 billion and the EUR 750 billion own resources decision, unless the rule of law criteria are revised, Kovács said:",NEUTRAL,0.001607157289981842,0.058446791023015976,0.9337424635887146,0.006203649565577507
A következtetése helyes.,3,3,24,24,Your conclusion is correct.,NEUTRAL,0.10349124670028687,0.027965053915977478,0.4594790041446686,0.40906471014022827
"A jogállamisági rendeletben – amely jogállami kritériumokhoz kötné az uniós források kifizetését – nem követelmény az egyhangúság, így ott nem vétóról van szó, hanem egy elutasító magyar (és lengyel) álláspontról, de ettől még ez a rendelet hatályba tud majd lépni. A német soros elnökség hétfő délutáni brüsszeli tanácskozásán minden tagállamnak politikai állásfoglalást kell tennie a három szóban forgó rendeletről, ez lényegében egy tesztszavazásnak fog számítani.",4,3,467,24,"In the Rule of Law Regulation, which would link the payment of EU funds to the rule of law criteria, unanimity is not a requirement, so it is not a veto, but a negative Hungarian (and Polish) position, but this regulation will still be able to enter into force. At the German presidency meeting in Brussels on Monday afternoon, all Member States must take a political position on the three regulations in question, which will essentially constitute a test vote.",NEUTRAL,1.8705471302382648e-4,0.01849268190562725,0.9682492017745972,0.013071058318018913
