article_text,paragraphs,article,n_characters,news_site,article_text_eng,Sentiment,Mixed,Negative,Neutral,Positive
"Azt mondta: „Tehát szeretném aláhúzni, hogy nem miattunk van szükség egy új, extra európai pénzügyi tervre. Erre a tervre azért van szükség, mert vannak az unión belül olyan országok, akik nem tudják ellenőrzés alatt tartani az államadósságukat, és eladósodtak. És a kérdés az, hogy tudunk-e segítséget nyújtani ezeknek az országoknak. És bár Magyarország ösztönösen ellenzi a közös hitelfelvételt, de belátjuk, hogy most vannak országok, akiknek segítségre van szükségük, és ezért elfogadjuk az uniónak a megközelítését, hogy hitelt vegyünk föl.”",14,11,547,444,"He said: 'So I would like to underline that we are not the reason why we need a new, extra European financial perspective. This plan is necessary because there are countries within the EU who cannot control their sovereign debt and are indebted. And the question is whether we can help these countries. And although Hungary is instinctively opposed to joint borrowing, we see that now there are countries who need help, and therefore we accept the EU's approach to taking credit.”",NEUTRAL,0.010534555651247501,0.033897824585437775,0.9321758151054382,0.023391801863908768
"A múlt héten a Reuters írta meg, hogy Magyarország összesen 2,5 milliárd euró értékben adott el 10 és 30 éves devizakötvényeket, amikre több mint ötszörös kereslet volt. Az Államadósság Kezelő Központ Zrt. anyagában előtte még 2 milliárdos terv szerepelt – írta a Portfolio.",15,11,274,444,"Last week, Reuters wrote that Hungary sold 10 and 30 years of foreign exchange bonds worth 2.5 billion euros, for which there was more than five times the demand. In the material of the National Debt Management Centre Zrt. there was a plan of 2 billion HUF — the Portfolio wrote.",NEUTRAL,5.5444947065552697e-5,0.010336977429687977,0.9759014844894409,0.013706055469810963
"A tárgyalásokon kívül egyelőre nem keresnek más megoldást a jogállamisághoz kötött uniós költségvetés-tervezet elfogadására, hangzott el Európa kormányfőinek csütörtök esti videókonferenciáján.",1,12,193,444,"Apart from the negotiations, there is no other way to adopt a draft EU budget linked to the rule of law, which was said at the video conference of the Heads of Government of Europe on Thursday evening.",NEUTRAL,7.197703962447122e-5,0.026071777567267418,0.9728803038597107,9.7590999212116e-4
Angela Merkel német kancellár a konferencián a jogállamisághoz között hétéves költségvetésről azt mondta:,2,12,105,444,German Chancellor Angela Merkel at the conference on the rule of law between seven-year budget said:,NEUTRAL,6.667844445473747e-6,0.0010323977330699563,0.9977174997329712,0.0012435048120096326
"„Egyértelművé tettem, hogy szerintem jó és kiegyensúlyozott kompromisszumot találtunk a javaslattal.”Hozzátette, hogy továbbra is tárgyalnak a javaslatcsomagot megvétózó Lengyelországgal és Magyarországgal, és egyelőre nem keresnek más megoldást a költségvetési csomag és a mentőcsomag elfogadására. Ursula von der Leyen, a bizottság elnöke szerint nagy szükség lenne a gyors megegyezésre, mert komoly a válság.",3,12,411,444,"“I made it clear that I think we have found a good and balanced compromise with the proposal.”He added that they continue to negotiate with Poland and Hungary, which vetoed the package of proposals, and that they are not looking for any other way to adopt the budget package and the rescue package. Ursula von der Leyen, the chairman of the committee said that a swift agreement would be needed because the crisis is serious.",NEUTRAL,0.00438273698091507,0.016807058826088905,0.8869383335113525,0.09187179058790207
"„Ha engem kérdezne arról, hogyan kell megoldani ezt a problémát, akkor azt mondanám, hogy kérdezze meg azt a kettőt, ők hogyan akarják megoldani” - fogalmazta meg sarkos véleményét a holland kormányfő, Mark Rutte.",4,12,213,444,"“If you were asking me about how to solve this problem, I would say that you ask those two how they want to solve it,” said the Dutch Prime Minister Mark Rutte.",NEUTRAL,8.684120984980837e-5,0.038752514868974686,0.9157778024673462,0.045382916927337646
"Orbán Viktor péntek reggel a Kossuth-rádióban azt mondta, hogy Soros György „utasításokat ad tulajdonképpen a brüsszeli bürokratáknak, hogy most akkor mit kell tenni”, ugyanakkor szerinte természetes, hogy a költségvetési viták késhegyig mennek. (via 24.hu)",5,12,257,444,"On the Kossuth Radio Friday morning, Mr. Orbán said that George Soros “gives instructions to Brussels bureaucrats what to do now”, however, he considers it natural that budgetary debates go to knife-tip. (via 24.hu)",NEUTRAL,2.0479646627791226e-4,0.047821223735809326,0.9427824020385742,0.009191629476845264
"Masszív sorosozással indította péntek reggelt Orbán Viktor a Kossuth Rádióban. Az uniós költségvetés megvétózárásáról és a jogállamisági feltételekről szóló vitát Magyarország miniszterelnöke röviden úgy értékelte: „„Hát Soros György fenyegeti Magyarországot meg Lengyelországot.”  Később kibontotta, hogy ezzel Soros György publicisztikájára utalt, ami szerinte tele van fenyegetéssel és zsarolással. „Utasításokat ad tulajdonképpen a brüsszeli bürokratáknak, hogy most akkor mit kell tenni. És szerintem erre született meg az a nyugodt és higgadt reakció tegnap a miniszterelnökök ülésén, hogy az a miniszterelnökök dolga, hogy hogyan kell egy vitát elrendezni” - mondta Orbán. ",1,13,680,444,"Viktor Orbán started Friday morning on Kossuth Radio with massive series. The Prime Minister of Hungary briefly assessed the debate on the veto of the EU budget and the rules of law: “George Has Soros threatens Hungary and Poland.” Later, he unfolded that he was referring to George Soros's publicity, which he believes is full of threats and blackmail. “In fact, it gives instructions to Brussels bureaucrats as to what needs to be done now. And that is what I think the calm and calm reaction was born yesterday at the meeting of prime ministers, that it is up to the prime ministers to how to settle a debate,” Orbán said.",NEUTRAL,6.78619253449142e-4,0.05512579157948494,0.8567674160003662,0.08742821961641312
"Egyébként a miniszterelnök szerint nem példátlan az Európai Unió esetében, hogy a költségvetési viták késhegyig mennek, és természetesnek tartja, hogy viták vannak, amiket rendezni kell. Orbán szerint akik arról beszélnek, hogy a magyar és a lengyel vétó fenyegetést jelent, mert a déli államok így nem kapják meg a pénzt a válságkezelésre, „azok az emberek, akiket Soros György fizet”.",2,13,386,444,"By the way, according to the Prime Minister, it is not unprecedented in the case of the European Union that budgetary debates go to the tip of knives and considers it natural that there are disputes that need to be settled. According to Orbán, those who talk about the Hungarian and Polish veto are a threat, because the southern states do not receive money for crisis management are “the people whom George Soros pays”.",NEUTRAL,0.0037899957969784737,0.22931984066963196,0.7625685334205627,0.0043216184712946415
"„Ma a világpolitika legkorruptabb embere, az Soros György. Ugye a korrupcióhoz két ember kell: aki a pénzt adja, meg aki elfogadja. És Soros György nagyon sok politikust fizet. Tehát ő az, aki leginkább korrumpálja az európai politikát. Akik most megszólalnak, és a Soros-féle mesterterv végrehajtásában vállalnak szerepet a megszólalásukkal, vagyis támadják, zsarolni akarják Magyarországot meg Lengyelországot, azok bizony mind Soros György által korrumpált politikusok” - foglalta össze a miniszterelnök, hogy szerinte hogy működik a világ. ",3,13,544,444,"“Today, the most corrupt man in world politics is George Soros. Corruption takes two people: the one who gives the money and the one who accepts it. And George Soros pays a lot of politicians. So it is he who is the most corrosive of European politics. Those who speak now and play a role in the implementation of the Soros master plan, namely attack and blackmail Hungary and Poland are all politicians that are corrupt by George Soros”, the Prime Minister summed up how the world.",NEGATIVE,0.001181024475954473,0.797739565372467,0.1969100683927536,0.0041693635284900665
"Azt is hasonló logika mentén értékelte, hogy a magyarokon és a lengyeleken kívül az összes többi ország megszavazta, hogy támogatási pénzek befagyasztásával is számon lehessen kérni a tagállamok kormányain a jogállamiság rombolását: „Ez valójában nem joguralom, hanem többségi uralom dolga. Azt szeretnék, hogyha a mostani helyzethez képest az uniós tagállamok többsége is rá tudná szorítani egyik vagy másik tagállamát arra, hogy valamit tegyen vagy ne tegyen.” ",4,13,463,444,"He also assessed on a similar logic that all other countries, apart from Hungarians and Poles, voted to ask the governments of the Member States for the destruction of the rule of law by freezing subsidy funds: “This is not a matter of rule of law, but of majority rule. They want a majority of EU Member States to be able to force one or another Member State to do something or not to do it.”",NEUTRAL,5.253022027318366e-5,0.01802871562540531,0.9784295558929443,0.0034892584662884474
"Szerinte most arról van szó, hogy egy-egy ország menekültpolitikáját nem az Európai Unió Bírósága vagy más pártatlan testület ítélné meg, „hanem egy politikai testület szavazná le a kisebbségben maradókat, és mondaná azt mondjuk, hogy Magyarország nem építhet kerítést. Vagy mondhatja azt, hogy ha van is kerítés, akkor is be kell engedni a migránsokat. Vagy mondhatja azt, hogy ha a migránsok beléptek Magyarország területére, nem tarthatók fogva”. Orbán Viktor felfogása szerint most - Soros György vezényletével -olyan eszközöket akarnak létrehozni, amivel jogszerűen lehet azt mondani, hogy „Magyarországnak le kell bontania a kerítést”.",5,13,641,444,"In his view, the question is that the asylum policy of a country would not be judged by the Court of Justice of the European Union or by any other impartial body, “but a political body would vote out those who remain in minority and say that Hungary cannot build a fence. Or you can say that even if there is a fence, you have to let migrants in. Or you can say that if migrants have entered the territory of Hungary, they cannot be detained.” According to Mr. Orbán's view, now, under the leadership of George Soros, they want to create tools that can legitimately say that “Hungary must tear down the fence”.",NEUTRAL,0.001969181001186371,0.11366268247365952,0.8818274736404419,0.00254064635373652
"A szociális és az oktatási intézményekben bevetett gyorstesztek hatékonyságával kapcsolatban a miniszterelnök még mindig szkeptikus, azt mondta, ezek most azért vannak, mert az érintettek kérték.  „Úgy látom, hogy ahogy nő a nyomás, úgy egyre inkább az egészségügyi dolgozóknál, a szociális intézményekben dolgozóknál meg az oktatásban dolgozóknál nő az igény, hogy még ha ilyen felemás, bizonytalan, nem teljesen megbízható eredményekre vezet is a tesztelés, jobban érzik magukat valahogy, magabiztosabbnak érzik magukat az emberek, hogyha egy ilyen tesztelésen átmennek.” Hozzátette, hogy a vakcina megérkezése után az átoltást is ugyanabban a rendszerben oldják meg, mint a tömeges tesztelést. ",6,13,697,444,"Regarding the effectiveness of rapid tests in social and educational institutions, the Prime Minister is still skeptical, he said that these are now because the stakeholders have asked for it. “I see that as the pressure increases, the demand for healthcare workers, social institutions and education workers is increasing, that even if testing leads to such uneven, uncertain, unreliable results, they feel better somehow, People feel more confident when they pass a test like this.” He added that after the arrival of the vaccine, the vaccination is also carried out in the same system as mass testing.",NEUTRAL,0.0796143189072609,0.10756252706050873,0.7666281461715698,0.04619495943188667
"Egyébként Müller Cecíliára hivatkozva azt mondta, semmilyen bizonyíték nincs arra, hogy megkezdődött volna a fertőzés lassulása. „Az, hogy ez most megállt, ebből az is lehet, hogy majd felfele indul meg, meg az is, hogy majd lefele indul meg. De semmilyen bizonyíték nincs arra, hogy túl lennénk a nehezén.”",7,13,307,444,"By the way, Müller, referring to Cecilia, said that there is no evidence that the deceleration of the infection has begun. “The fact that this has stopped, it may also start upwards, and it will go down. But there's no evidence that we're over the worst.”",NEUTRAL,0.0011143345618620515,0.16257646679878235,0.8276417851448059,0.008667467162013054
Hungary and Poland blocked adoption of the European Union's 2021-2027 budget and coronavirus recovery package on Monday over a new mechanism linking access to EU funds with rule of law criteria.,1,14,194,444,Hungary and Poland blocked adoption of the European Union's 2021-2027 budget and coronavirus recovery package on Monday over a new mechanism linking access to EU funds with rule of law criteria.,NEUTRAL,0.015592860989272594,0.07467325031757355,0.9053376913070679,0.004396260716021061
They were the only countries in the 27-member bloc to do so. ,2,14,61,444,They were the only countries in the 27-member bloc to do so.,NEUTRAL,0.07515858858823776,0.13941939175128937,0.769831120967865,0.015590840950608253
The veto by the two countries draws the fate of the €1.1 trillion budget and €750 billion recovery package into uncertainty as the economies of many European countries are hit by new lockdowns amid the worsening pandemic.,3,14,221,444,The veto by the two countries draws the fate of the €1.1 trillion budget and €750 billion recovery package into uncertainty as the economies of many European countries are hit by new lockdowns amid the worsening pandemic.,NEUTRAL,0.24012529850006104,0.28038734197616577,0.47426924109458923,0.0052180662751197815
"The rule of law conditionality, which would tie disbursal of EU funds to member states' adherence to democratic standards, was approved by EU ambassadors on Monday with a necessary qualified majority, but Hungary and Poland used their veto power to block an agreement on the framework of the economic recovery package, effectively stalling progress of the measures.",4,14,365,444,"The rule of law conditionality, which would tie disbursal of EU funds to member states' adherence to Democratic standards, was approved by EU ambassadors on Monday with a necessary qualified most, but Hungary and Poland used their veto power to block an agreement on the framework of the economic recovery package, effectively stalling progress of the measures.",NEUTRAL,2.267180971102789e-4,0.06256313621997833,0.932624101638794,0.004586033523082733
"European heads of state and government will meet via videoconference on Thursday to resume discussions over the stalled budget, but a resolution of the stalemate is not expected by then.",5,14,186,444,"European heads of state and government will meet via videoconference on Thursday to resume discussions over the stalled budget, but a resolution of the stalemate is not expected by then.",NEUTRAL,6.2510248972103e-4,0.027569588273763657,0.9640257358551025,0.007779604755342007
Hungary and Poland were the two largest net beneficiaries of EU funds in 2018.,6,14,78,444,Hungary and Poland were the two largest net beneficiaries of EU funds in 2018.,NEUTRAL,3.728769952431321e-4,0.002606234746053815,0.9874629974365234,0.0095578758046031
Hungarian officials have argued that the rule of law condition is an attempt by Brussels to force Hungary to change its controversial policies on immigration and blackmail the country into accepting dictates from the European Union. ,7,14,233,444,English executies have argued that the rule of law condition is an attempt by Brussels to force Hungary to change its controversial policies on immigration and blackmail the country into accepting dictates from the European Union.,NEUTRAL,2.877494553104043e-4,0.05240263417363167,0.946413516998291,8.96159908734262e-4
"In a statement on Tuesday, Prime Minister Viktor Orbán wrote, ""In Brussels today, they only view countries which let migrants in as those governed by the rule of law. Those who protect their borders cannot qualify as countries where rule of law prevails."" ",8,14,256,444,"In a statement on Tuesday, Prime Minister Viktor Orbán wrote, “In Brussels today, they only view countries which let migrants in as those governed by the rule of law. Those who protect their borders cannot qualify as countries where rule of law prevails.”",NEUTRAL,2.4753212346695364e-4,0.02893238700926304,0.9692758917808533,0.00154424412176013
"But the EU's concerns over Hungary's adherence to the rule of law have focused primarily on media freedom, judicial independence and corruption, and migration has not been featured among the rule of law conditions articulated by the new mechanism. ",9,14,248,444,"But the EU's concerns over Hungary's adherence to the rule of law have focused first on media freedom, judicial independence and corruption, and migration has not been featured among the rule of law conditions articulated by the new mechanism.",NEUTRAL,0.003935335669666529,0.042699702084064484,0.9507442116737366,0.002620773622766137
"The stalemate will be difficult to break as the Hungarian government has indicated it will not budge on its position, and numerous EU leaders have also insisted the rule of law mechanism is not negotiable.",10,14,205,444,"The stalemate will be difficult to break as the Hungarian government has denied it will not budge on its position, and numerous EU leaders have also insisted the rule of law mechanism is not negotiable.",NEUTRAL,0.0010438159806653857,0.2765332758426666,0.7213438749313354,0.001079023815691471
"On Wednesday, Hungary's six largest opposition parties signed a joint statement condemning the Orbán government's veto of the budget, informing the nations and citizens of Europe that ""Viktor Orbán and his government are not equivalent with Hungary as a country.""",11,14,263,444,"On Wednesday, Hungary's six largest opposition parties signed a joint statement condemning the Orbán government's veto of the budget, informing the nations and citizens of Europe that “Viktor Orbán and his government are not equivalent with Hungary as a country.”",NEUTRAL,4.323924076743424e-4,0.07234242558479309,0.9197307825088501,0.0074943918734788895
"
""We call on European Union institutions and the governments of member states to find a solution so that the selfishness of the Orbán government is not an obstacle to solving the European and Hungarian economic crisis, and so that Hungarian citizens and businesses who are worried for their security and existence may access the support the European Union intended for Hungary as soon as possible,"" the parties wrote.",12,14,417,444,"
“We call on European Union institutions and the government of member states to find a solution so that the selfishness of the Orbán government is not an obstacle to solving the European and Hungarian economic crisis, and so that Hungarian citizens and businesses who are and existence may access the support of the European Union intended for Hungary as soon as possible,” the parties wrote.",NEUTRAL,0.02077658101916313,0.00889601744711399,0.9605945348739624,0.009732886217534542
A recording obtained by the Budapest bureau of Radio Free Europe/Radio Liberty revealed editors at state media company MTVA instructed reporters on what topics to cover and how to color stories to fit a desired narrative. ,13,14,222,444,Recording received by the Budapest bureau of Radio Free Europe/Radio Liberty revealed editors at state media company MTVA instructed reporters on what topics to cover and how to color stories to fit a wanted narrative.,NEUTRAL,7.798846127116121e-6,0.0024697440676391125,0.9919084906578064,0.005613937973976135
"One recording, taken just before European Parliament elections in 2019, features lead editor Balázs Bende instructing reporters on how to cover opposition parties and issues important in the election.",14,14,200,444,"One recording, taken just before European Parliament elections in 2019, features lead editor Balázs Bende instructing reporters on how to cover opposition parties and issues important in the election.",NEUTRAL,8.497454109601676e-5,0.007578058633953333,0.9722257852554321,0.020111234858632088
"""European Parliament elections are coming at the end of May, and I'm sure no one will be surprised to hear me say that this institution does not support opposition cooperation,"" Bende said in the recording, referring to opposition parties coordinating their candidates against those of Fidesz. ""Whoever is on shift must produce content according to the appropriate narrative, method, and direction...mostly about migrants and Brussels."" ",15,14,437,444,"'European Parliament elections are coming at the end of May, and I'm sure no one will be sure to hear me say that this institution does not support opposition cooperation, 'Bende said in the recording, referring to opposition parties coordinating their candidates against those of Fidesz. “Whoever is on shift must produce content according to the appropriate narrative, method, and direction... mostly about migrants and Brussels.”",NEUTRAL,0.011615763418376446,0.35209089517593384,0.6286228895187378,0.007670425809919834
"Bende told reporters that if they were unwilling to comply with the instructions, they could ""go and submit their resignation papers to the boss and leave. No one is forcing you to work here.""",16,14,192,444,"Bende told reporters that if they were unwilling to comply with the instructions, they could “go and submit their resignation papers to the boss and leave. No one is forcing you to work here.”",NEUTRAL,0.0047182561829686165,0.4067208766937256,0.5857492685317993,0.0028116190806031227
"MTVA news director Zsolt Németh also gave instructions on bringing pro-government commentators onto programs to ""simplify things for the people"" on how they should interpret particular issues.",17,14,192,444,MTVA news director Zsolt Németh also gave instructions on bringing pro-government commentators onto programs to “simplify things for the people” on how they should interpret particular issues.,NEUTRAL,2.528075492591597e-5,0.003699898486956954,0.9840676784515381,0.012207151390612125
"RFE/RL also obtained internal MTVA emails where reporters were instructed to insinuate that Hungary was faring better than other countries with the coronavirus, and to take a critical stance on migration, LGBTQ issues, climate change and other issues.",18,14,251,444,"RFE/RL also got internal MTVA emails where reporters were instructed to insinuate that Hungary was faring better than other countries with the coronavirus, and to take a critical stance on migration, LGBTQ issues, climate change and other issues.",NEUTRAL,0.009908121079206467,0.08550672233104706,0.8845627903938293,0.020022399723529816
"""We were instructed not to use the word 'refugee' in any context,"" one unidentified reporter told the outlet. ""Even among people who were officially granted refugee status, we talked about them as migrants.""",19,14,207,444,"“We were instructed not to use the word 'refugee' in any context,” one unidentified reporter told the outlet. “Even among people who were officially granted refugee status, we were talking about them as migrants.”",NEUTRAL,1.0125335393240675e-4,0.018502933904528618,0.9812109470367432,1.8483595340512693e-4
"MTVA journalists who spoke to RFE/RL described a ""mafia-like"" atmosphere of intimidation at the broadcaster. ",20,14,109,444,MTVA journalists who spoke to RFE/RL described a “mafia-like” atmosphere of intimidation at the broadcaster.,NEUTRAL,3.131902776658535e-4,0.16887976229190826,0.8296770453453064,0.0011300238547846675
"When asked during a session of Parliament about the political directives given at the publicly-funded broadcaster, state secretary Balázs Orbán said that diversity in the media prevails in Hungary, and that the government does not wish to interfere in the work of media organizations.",21,14,284,444,"When asked during a session of Parliament about the political directives given at the publicly-funded broadcaster, state secretary Orbán Balázs said that diversity in the media prevails in Hungary, and that the government does not wish to interact in the work of media organization.",NEUTRAL,1.7494268831796944e-4,0.03303619101643562,0.9629776477813721,0.003811166388913989
"Hungary's total death rate was up significantly in mid-October, according to the Central Statistics Office, most likely a consequence of the coronavirus pandemic.",22,14,162,444,"Hungary's total death rate was up significantly in mid-October, according to the Central Statistics Office, now likely a effect of the coronavirus pandemic.",NEUTRAL,1.9854654965456575e-4,0.2126339077949524,0.7848271131515503,0.002340493490919471
