article_text,paragraphs,article,n_characters,news_site,article_text_eng,Sentiment,Mixed,Negative,Neutral,Positive
"Augusto Santos Silva, az Európai Unió Tanácsának soros elnöki tisztségét Németország után, januártól betöltő Portugália külügyminisztere aláhúzta, hogy német kollégájának derűlátását osztva ugyancsak arra számít, hogy az Európai Tanács decemberi üléséig sikerül megoldást találni a hétéves költségvetés és a helyreállítási alap ügyére, és mindenekelőtt Angela Merkel kancellár tudásában, tapasztalataiban bízik.",12,20,411,24,"Augusto Santos Silva, Minister of Foreign Affairs of Portugal, who held the rotating presidency of the Council of the European Union after Germany, underlined that dividing the optimism of his German colleague also expects to find a solution by the December European Council budget and recovery fund, and above all the knowledge and experience of Chancellor Angela Merkel.",NEUTRAL,7.867440217523836e-6,0.0017374033341184258,0.9929754734039307,0.005279318895190954
"Kifejtette: úgy látja, hogy Magyarországnak és Lengyelországnak két ponton vannak fenntartásai, az egyik a jogbiztonság az uniós források felhasználásának folyamatában, a másik pedig a nemzeti szuverenitás tisztelete. Hangsúlyozta, hogy mindkét ügyben lehetséges kidolgozni mindenkinek elfogadható megoldást.",13,20,308,24,He explained that he considers that Hungary and Poland have two reservations: legal certainty in the process of using EU funds and respect for national sovereignty. He stressed that it is possible to develop a solution acceptable to everyone in both cases.,NEUTRAL,0.006237240508198738,0.002591259777545929,0.9662827849388123,0.024888772517442703
"A magyar és a lengyel kormány november 16-án jelezte, hogy a jogállamisági mechanizmus miatt nem lát lehetőséget az uniós költségvetés és a helyreállítási alap elfogadására.",14,20,173,24,"On 16 November, the Hungarian and Polish Governments indicated that the Rule of Law Mechanism did not see the possibility of adopting the EU budget and the Recovery Fund.",NEUTRAL,7.67690798966214e-5,0.098773293197155,0.9001429080963135,0.0010071186115965247
"Deutsch Tamás a Magyar Nemzetnek azt mondta, szerinte Manfred Weber ugyanúgy érvelt, mint annak idején a Gestapo és az ÁVH, amikor arról beszélt, Orbán Viktornak nincs félnivalója a jogállamisági kritériumoktól, ha valóban szabad a sajtó és független az igazságszolgáltatás. Azért vonta ezt a történelmi párhuzamot, mert szerinte akkor is önkényes politikai döntések alapján büntettek meg bárkit, bármikor, bármiért, és most erre készül az Euró­pai Unió is.",1,21,457,24,"Tamás Deutsch told the Hungarian Nation that Manfred Weber argued in the same way as the Gestapo and ÁVH at the time when he said that Viktor Orbán had nothing to fear from the rule of law criteria if the press is free and the judiciary is independent. He drew this historical parallelism because, in his view, anyone was punished on the basis of arbitrary political decisions, at any time, for anything, and that is what the European Union is preparing for.",NEUTRAL,8.606140181655064e-5,0.006907230243086815,0.965162992477417,0.027843758463859558
"Az Európai Parlament fideszes képviselője szerinte az Európai Néppárt (EPP) parlamenti frakcióvezetőjének kritikái hiteltelenek, miután elismerte, a Sargentini-jelentés állításai nem állnák meg helyüket a bíróság előtt.",2,21,219,24,"According to the Fidesz Member of the European Parliament, the criticisms of the Head of Parliamentary Group of the European People's Party (EPP) are uncredited after acknowledging that the statements of the Sargentini report would not stand in court.",NEUTRAL,1.2979967868886888e-4,0.07441955804824829,0.9248585104942322,5.921574775129557e-4
"Ezek után mi mást is mondhatnánk, köszönjük szépen, de a hazug Sargentini-jelentést megszavazó politikusoktól nem fogadunk el leckét jogállamiságból sem.",3,21,153,24,"What else can we say, thank you very much, but we are not taking lessons from the politicians who voted for the lying Sargentini report, either in the rule of law.",MIXED,0.7043160200119019,0.049156028777360916,0.16558606922626495,0.08094192296266556
Deutsch az EU-támogatások jogállamisági kritériumokhoz kötése miatt még keményebben bírálta az Európai Parlamentet.,4,21,115,24,Deutsch criticised the European Parliament even harder for the binding of EU funds to the rule of law criteria.,NEUTRAL,0.004060353152453899,0.10971593111753464,0.880531907081604,0.005691857077181339
"A szánalmas valóságshow-kban levitézlett celebek cicaharcára emlékeztet, ahogy az Európai Parlament presztízsküzdelmet folytat a tagországokat képviselő uniós intézménnyel, a tanáccsal szemben. (…) Mára sajnos odáig jutottunk, hogy az EP többsége a tagállamokban, a nemzetállamokban látja az európai fejlődés elsőrendű akadályát. Ez a helyzet olyan, mintha a befőtt akarná eltenni a nagymamát: nem az Európai Bizottság, az uniós parlament vagy éppen az Európai Bíróság hozta létre a tagállamokat, alapította meg mondjuk Németországot, Hollandiát vagy bármely más országot, hanem éppen fordítva történt.",5,21,602,24,"It reminds me of the cat fight of celebrities in pathetic reality shows, as the European Parliament is engaged in prestige trade against the EU institution representing Member States, the Council. (...) Unfortunately, we have come to the point that the majority of the EP sees the primary obstacle to European development in the Member States, in the nation states. This situation is like compote trying to put away grandma: it was not the European Commission, the EU Parliament or the European Court of Justice that created the Member States, whether Germany, the Netherlands or any other country, but the other way around.",NEGATIVE,0.2609105408191681,0.5252723693847656,0.21038104593753815,0.003436017083004117
"Az interjúban a kormánypárti politikus azt mondta, nem a magyar és a lengyel vétó a zsarolás, valójában az Európai Parlament zsarolt, amikor megtámadta az Euró­pai Tanács júliusi megállapodását, és a megoldás is egyszerű lenne, ha visszatérnének ahhoz. Deutsch arra is emlékeztetett, ők soha nem támadtak más országokat ideológiai viták miatt. A genderügyben is csak azt vallják, amit a magyarok elsöprő többsége.",6,21,413,24,"In the interview, the pro-government politician said that the Hungarian and Polish veto is not the blackmail; in fact, the European Parliament was blackmailing when it challenged the July agreement of the European Council, and the solution would be easy if they returned to it. Deutsch also reminded me that they never attacked other countries because of ideological debates. In the gender case, they only testify what the overwhelming majority of Hungarians do.",NEUTRAL,0.017307346686720848,0.24807609617710114,0.7290064096450806,0.005610206630080938
"A Fidesz esetleges kizárásáról az Európai Néppártból azt mondta, Manfred Weber és Donald Tusk nyilatkozataival ellentétben az EPP-tagság kétharmada valójában párbeszéd útján rendezné a vitákat, a Fideszt a pártcsaládon belül az elenyésző támogatottságú pártok kritizálják. Weber az Európai Parlament elnöke akar lenni 2022-ben, ehhez baloldali voksokat is remél, a „jogállamisági” megfontolásoknál személyes hatalmi ambíciói fontosabbak.",7,21,437,24,"On the possible exclusion of Fidesz from the European People's Party, he said that, contrary to the statements of Manfred Weber and Donald Tusk, two-thirds of EPP membership would actually settle disputes through dialogue, and Fidesz is criticised by parties with insignificant support within the party family. Weber wants to be President of the European Parliament in 2022, he also hopes for left-wing votes, and his personal power ambitions are more important than the “rule of law” considerations.",NEUTRAL,1.8215648015029728e-4,0.04599533975124359,0.9418726563453674,0.011949834413826466
"Nagyon nehéz megoldásra jutni az Európai Unió következő hétéves költségvetése, a koronavírus-járvány okozta károk helyreállítását szolgáló alap és a források felhasználását feltételekhez kötő mechanizmus ügyében – mondta az Európai Unió Tanácsának soros elnöki tisztségét betöltő német kormány szóvivője pénteken Berlinben.",1,22,323,24,"It is very difficult to find a solution for the next seven-year budget of the European Union, the fund to make good the damage caused by the coronavirus epidemic and the mechanism of conditional use of resources — the German government holding the rotating presidency of the Council of the European Union said spokesman on Friday in Berlin.",NEGATIVE,0.005019648466259241,0.5654876828193665,0.42386141419410706,0.005631197243928909
"Steffen Seibert tájékoztatóján arra a lengyel hírre vonatkozó kérdésre reagált, miszerint Angela Merkel kancellár és Mateusz Morawiecki lengyel kormányfő megbeszélést folytatott. Felidézte, hogy a kancellár a tagországi vezetőket összefogó Európai Tanács legutóbbi videokonferenciája után kifejtette, hogy további tárgyalások következnek Lengyelországgal és Magyarországgal.",2,22,374,24,"In his briefing, Steffen Seibert responded to the Polish news that Chancellor Angela Merkel and Polish Prime Minister Mateusz Morawiecki had a meeting. He recalled that the Chancellor explained after the latest videoconference of the European Council, which brings together the leaders of the Member States, that further negotiations are coming with Poland and Hungary.",NEUTRAL,2.951432406916865e-6,0.0010900194756686687,0.9956656098365784,0.00324144191108644
"Ezek a tárgyalások „folyamatban vannak” – mondta a kormányszóvivő, hozzátéve, hogy nincs lehetősége részletek ismertetésére, azt viszont el tudja mondani, hogy a megoldás megtalálása „még nem megoldott, és nagyon nehéz” feladat.",3,22,228,24,"These negotiations are “in progress”, the Government Spokesperson said, adding that there is no possibility to describe details, but he can say that finding a solution is “not yet solved and very difficult”.",NEUTRAL,0.001116531202569604,0.041720449924468994,0.9532685875892639,0.003894499968737364
Európában a sértegetések soha nem vezetnek valamennyi félnek kedvező eredményekre,4,22,81,24,"In Europe, insults never lead to positive results for all parties",NEGATIVE,0.06640736758708954,0.6817792654037476,0.243583083152771,0.008230245672166348
"– mondta a kormányszóvivő arra a kérdésre, miként értékeli Angela Merkel, hogy a Fidesz soraiban a náci Németország államvédelmi hatóságához, a Gestapóhoz hasonlítják Manfred Webert, az Európai Néppárt európai parlamenti (EP-) frakcióvezetőjét.",5,22,244,24,"— said the government spokesperson on the question of how Angela Merkel assesses that the Fidesz ranks compare Manfred Weber, the leader of the European Parliament (EP) group to the Gestapo of Nazi Germany's State Protection Authority.",NEUTRAL,6.559805478900671e-5,0.005159622523933649,0.9939218759536743,8.528358303010464e-4
"Azt látjuk, hogy nagyon nehéz megtalálni az EP és a tagállamok számára elfogadható utat",6,22,87,24,We see that it is very difficult to find a path acceptable to the EP and the Member States,NEGATIVE,0.014214808121323586,0.7560191750526428,0.22470302879810333,0.005063035059720278
– tette hozzá Steffen Seibert.,7,22,30,24,— added Steffen Seibert.,NEUTRAL,8.833185347612016e-6,1.3255220255814493e-4,0.9987748265266418,0.0010838382877409458
"Kiemelte: Angela Merkel megítélése szerint egy „nagyon jó, és kiegyensúlyozott kompromisszum” alakult ki a soros német elnökség és az EP tárgyalásain a költségvetés és a helyreállítási alap forrásainak felhasználási feltételeit szabályozó mechanizmusról. Azonban további tárgyalásokat kell folytatni arról, hogy mi lehet a mindenkinek elfogadható megoldás.",8,22,356,24,"He stressed that Angela Merkel considers that a “very good and balanced compromise” has emerged during the negotiations between the German presidency and the EP on the mechanism governing the conditions for the use of the budget and the recovery fund resources. However, further negotiations need to be held on what could be an acceptable solution for all.",NEUTRAL,0.03335869312286377,0.013671775348484516,0.9208672642707825,0.03210223466157913
"A magyar és a lengyel kormány november 16-án jelezte, hogy a források felhasználását jogállamisági feltételekhez kapcsoló mechanizmus miatt nem lát lehetőséget az uniós költségvetés és a helyreállítási alap elfogadására.",9,22,220,24,"On 16 November, the Hungarian and Polish Governments indicated that due to the mechanism linking the use of funds to rule of law conditions, they do not see the possibility of adopting the EU budget and the recovery fund.",NEUTRAL,0.0016191565664485097,0.06606370210647583,0.9303885102272034,0.001928600249812007
(MTI),10,22,5,24,(MTI),NEUTRAL,8.82452804944478e-5,1.4098799147177488e-4,0.9959329962730408,0.0038378057070076466
"Egy héten belül immár másodszor egyeztet egymással személyesen Orbán Viktor magyar és Mateusz Morawiecki lengyel miniszterelnök. Az újabb munkaértekezletre hétfő este kerül sor Varsóban – tájékoztatta az MTI-t Havasi Bertalan, a miniszterelnök sajtófőnöke, megerősítve az erről szóló lengyel sajtóhíreket.",1,23,305,24,"For the second time in a week, Prime Minister Viktor Orbán and Prime Minister of Poland Mateusz Morawiecki will consult each other personally. The new workshop will take place in Warsaw on Monday evening — Bertalan Havasi, press chief of the Prime Minister informed MTI, confirming the Polish press reports.",NEUTRAL,5.7066513363679405e-6,1.544079859741032e-4,0.9957548379898071,0.0040851314552128315
Lengyelországi sajtóorgánumoknak Piotr Müller kormányszóvivő elmondta: a mai kétoldalú megbeszélés célja további intézkedések megvitatása az EU-s költségvetési tárgyalások és a soron következő uniós csúcstalálkozó kapcsán.,2,23,222,24,Government Spokesperson Piotr Müller said that today's bilateral discussion aims to discuss further measures in connection with the EU budget negotiations and the forthcoming EU summit.,NEUTRAL,1.528132997918874e-5,1.7477202345617115e-4,0.9914119243621826,0.008398017846047878
"Többször is írtunk róla: Magyarország és Lengyelország addig nem mond igent az uniós költségvetés és a 750 milliárd eurós mentőcsomag elfogadására, amíg annak része egy olyan mechanizmus is, amivel a jogállami alapelveket megsértő országok pénzügyi támogatásait fel lehetne függeszteni.",3,23,286,24,"We have written about it several times: Hungary and Poland do not say yes to the adoption of the EU budget and the EUR 750 billion rescue package, as long as it also includes a mechanism for suspending financial support for countries that violate the principles of the rule of law.",NEUTRAL,0.024056103080511093,0.39434412121772766,0.5781845450401306,0.003415248589590192
"Múlt csütörtökön a két miniszterelnök közösen adott ki egy nyilatkozatot, ebben nemcsak azt írták le, mit gondolnak a vétó ügyéről, hanem arra is céloztak, mit gondolnak megoldásnak.",4,23,182,24,"Last Thursday, the two prime ministers jointly issued a statement describing not only what they thought about the veto issue, but also what they thought to be a solution.",NEUTRAL,2.9055625782348216e-4,0.04190787300467491,0.9499062895774841,0.007895306684076786
"Kiemelt kép: A Miniszterelnöki Sajtóiroda által közreadott képen Orbán Viktor magyar (j) és Mateusz Morawiecki lengyel kormányfő sajtótájékoztatót tart a Karmelita kolostorban 2020. november 26-án. Tárgyalásuk napirendjén az EU költségvetésének ügye szerepelt, ami ellen Magyarország és Lengyelország is vétót emelt amiatt, hogy az uniós pénzek felhasználását Brüsszel politikai feltételekhez akarja kötni. MTI/Miniszterelnöki Sajtóiroda/Fischer Zoltán",5,23,452,24,"Featured image: In the photo published by the Prime Minister's Press Office, Prime Minister Viktor Orbán of Hungary (j) and Mateusz Morawiecki of Poland will hold a press conference at the Carmelite Monastery on 26 November 2020. The issue of the EU budget was on the agenda of their negotiations, against which both Hungary and Poland have vetoed the intention of Brussels to make the use of EU funds subject to political conditions. MTI/Prime Minister's Press Office/Zoltán Fischer",NEUTRAL,5.088857506052591e-6,9.97212715446949e-4,0.9970483183860779,0.0019493666477501392
"A magyar gazdaság kapacitásának növekedésére 2021 második negyedévétől lehet számítani, ugyanis ekkor kezdik meg működésüket azok az új gépek, gépsorok, új technológiák, amelyeket a magyar vállalatok vásároltak meg a mostani nehéz időszakra reagálva kialakított beruházásösztönzési programban – mondta a külgazdasági és külügyminiszter kedden Budapesten az Országgyűlés gazdasági bizottságában",1,1,393,pestisracok,"The capacity of the Hungarian economy can be expected to increase from the second quarter of 2021, because that's when the new machines, machinery lines and new technologies purchased by Hungarian companies will start operating in response to the current difficult period — the Minister of Foreign Affairs and Trade said on Tuesday in Budapest in the Economic Committee of the National Assembly",NEUTRAL,8.022211113711819e-5,0.033837080001831055,0.9484152793884277,0.01766732893884182
"Szijjártó Péter éves meghallgatásán közölte: a beruházásösztönzési program különböző elemeiben összesen 1338 magyar vállalat, 824 milliárd forintnyi beruházás megvalósítását vállalta, amelyhez a kormány 336 milliárd forintnyi támogatást adott.",2,1,243,pestisracok,"Szijjártó Péter said at his annual hearing that in various elements of the investment promotion program a total of 1338 Hungarian companies, 824 billion HUF investment, to which the government provided 336 billion HUF support.",NEUTRAL,3.3619066925894003e-6,2.731142158154398e-4,0.9983060359954834,0.0014174688840284944
A program 264 500 munkahely megvédéséhez járult hozzá,3,1,53,pestisracok,"The programme has contributed to the protection of 264,500 jobs",NEUTRAL,9.503241744823754e-4,5.345828249119222e-4,0.8777415156364441,0.12077361345291138
– tette hozzá.,4,1,14,pestisracok,— he added.,NEUTRAL,0.0010047227842733264,0.001295914757065475,0.9864221811294556,0.011277224868535995
"A járvány első hullámában az Európai Unió 800 ezer euróra emelte a cégeknek adható állami támogatás mértékét, ezért a kormány úgy döntött, hogy azoknak a vállalatoknak, amelyek beruházásaiknak köszönhetően senkit nem bocsátanak el, a beruházási érték felét, maximum 800 ezer eurót megtérít. Ebben a konstrukcióban 904 vállalat vesz részt, és 421 milliárd forintnyi beruházást hajt végre.",5,1,387,pestisracok,"In the first wave of the epidemic, the European Union raised State aid to 800 thousand euros, so the government decided to reimburse companies which, thanks to their investments, do not make anyone redundant, half the investment value, up to 800 thousand euros. 904 companies participate in this project and invest 421 billion HUF.",NEUTRAL,0.005003843456506729,0.045362312346696854,0.9205294251441956,0.02910439297556877
"A beruházások, amelyekhez a kormány 201 milliárd forintnyi támogatást biztosít, 154 200 munkahelyet védenek meg",6,1,111,pestisracok,"Investments, for which the government provides 201 billion HUF support, protect 154,200 jobs",NEUTRAL,0.00781677570194006,0.0037612556479871273,0.8650513291358948,0.12337060272693634
– mondta a miniszter.,7,1,21,pestisracok,— said the minister.,NEUTRAL,1.4507635205518454e-4,0.0022860125172883272,0.9956604838371277,0.0019084218656644225
Forrás: MTI; Fotó: MTI/Koszticsák Szilárd,8,1,41,pestisracok,Source: MTI; Photo: MTI/Kosticsák Szilárd,NEUTRAL,1.1939934483962134e-4,1.9932891882490367e-4,0.998810887336731,8.703250205144286e-4
"Az amerikai spekuláns nem először jön elő ötletével, állítása szerint az örökjáradék-kötvények gondolatát szoknia kell a piacnak. Soros György legújabb, a Project Syndicate-ben megjelent cikkében arról ír, hogy Európa számára eljött a megfelelő pillanat, be lehet vezetni a soha le nem járó kötvényeket, ami örökre rabszolgasorba taszítaná a tagállamokat és a nemzetközösséget. ",1,2,378,pestisracok,"It is not the first time the American speculator has come up with his idea, and he claims that the market should get used to the idea of inheritance bonds. George Soros, in his latest article published in Project Syndicate, writes that the right moment has come for Europe to introduce never-expired bonds, which would enslave the Member States and the Commonwealth forever.",NEUTRAL,1.1367767001502216e-4,0.057959746569395065,0.9335616827011108,0.00836492981761694
"Újabb véleménycikk jelent meg Soros Györgytől a Project Syndicate nevű portálon, amelyben a magyar származású amerikai milliárdos arról értekezik, mit kellene tennie az Európai Uniónak azután, hogy Magyarország és Lengyelország megvétózta a következő hétéves költségvetést, amiért abban az unió zsarolni próbálta a független államokat. Cikkét Soros azzal kezdte, hogy a járvány miatti uniós költségvetés és helyreállítási csomag elfogadása még soha nem volt ennyire sürgős.",2,2,473,pestisracok,"Another opinion article was published by George Soros on Project Syndicate, in which the Hungarian-born American billionaire discusses what the European Union should do after Hungary and Poland vetoed the next seven-year budget for which the EU tried to blackmail the independent states. Soros began his article by saying that the adoption of the EU budget and the recovery package due to the epidemic has never been so urgent.",NEUTRAL,0.026505406945943832,0.09671305865049362,0.870206356048584,0.006575148552656174
"Cikkét Soros azzal kezdte, hogy a járvány miatti uniós költségvetés és helyreállítási csomag elfogadása még soha nem volt ennyire sürgős.",3,2,137,pestisracok,Soros began his article by saying that the adoption of the EU budget and the recovery package due to the epidemic has never been so urgent.,NEUTRAL,0.0968925803899765,0.20965655148029327,0.678517758846283,0.014933120459318161
Az örökös kötvények kibocsátásának ügye soha nem volt még ennyire fontos és sürgetőbb,4,2,85,pestisracok,The issue of the issuance of perpetual bonds has never been more important and urgent,NEUTRAL,0.014004124328494072,0.3171665668487549,0.663094162940979,0.005735204089432955
– írta Soros.,5,2,13,pestisracok,— by Soros.,NEUTRAL,2.0824807870667428e-4,0.008638057857751846,0.9907536506652832,4.000851768068969e-4
De mi is ez a kötvény? ,6,2,23,pestisracok,But what is this bond?,NEUTRAL,0.0060698832385241985,0.15168873965740204,0.8234416842460632,0.018799783661961555
"A HVG írt erről hosszabban korábban, leírták, hogy a lényege röviden az: más kötvényt, ha valaki megvásárol, akkor pénzt ad érte a kibocsátónak – ebben az esetben az államnak –, az állam pedig évek, akár évtizedek alatt kamatokkal fizeti ezt vissza. Az örökjáradék-kötvényekért az EU pénzt kapna azonnal, a tőkét soha nem kellene visszafizetni, a kamatokat viszont előre meghatározott összegben örökké. Soros maga is elismeri, hogy jelen helyzetben nagyjából nulla az esélye annak, hogy a kötvényeket kibocsássa az unió, annyira megosztottak a tagállamok. Soros megjegyzi, hogy a fukar ötök gúnynévvel ellátott tagállamok, Ausztria, Dánia, Finnország, Hollandia és Svédország sem érdekelt a kötvénykibocsátásban, ők inkább a megtakarításban látják a jövőt.",7,2,756,pestisracok,"HVG wrote about this in a long time earlier, and they described that the essence of it is that if you buy another bond, you give money to the issuer — in this case the state — and the state pays it back with interest over years, even decades. For inheritance bonds, the EU would receive money immediately, the capital would never have to be repaid, but interest would be paid in a predetermined amount forever. Soros himself acknowledges that, in this situation, the chances of bonds being issued by the Union are roughly zero, the Member States are so divided. Soros notes that the stingy five Member States with a mockery name, Austria, Denmark, Finland, the Netherlands and Sweden are not interested in bond issuance, and they tend to see the future in savings.",NEUTRAL,0.002171935513615608,0.14663675427436829,0.8295564651489258,0.021634815260767937
"Az örökjáradék-kötvényekért az EU pénzt kapna azonnal, a tőkét soha nem kellene visszafizetni, a kamatokat viszont előre meghatározott összegben örökké.",8,2,152,pestisracok,"For inheritance bonds, the EU would receive money immediately, the capital would never have to be repaid, but interest would be paid in a predetermined amount forever.",NEUTRAL,0.002771923318505287,0.10715322941541672,0.8786677122116089,0.011407178826630116
"A befektetők csak olyanoktól vásárolnak örökös kötvényeket, amelyek stabilak és elkötelezettségük a jövőben is fennáll ez ügyben",9,2,128,pestisracok,Investors only purchase perpetual bonds from those that are stable and have a commitment to this matter,NEUTRAL,0.03389070928096771,0.07908467948436737,0.8467142581939697,0.040310293436050415
